<visual-suite xmlns="http://www.jboss.org/test/visual-suite"
	xmlns:xsi="http://www.w3.org/2001/XMLSchema-instance"
	xsi:schemaLocation="http://www.jboss.org/test/visual-suite ../../main/resources/visual-suite.xsd">

	<global-configuration>
		<!-- the image retriever, implementing SourceRetriever interface -->
		<image-retriever class="org.jboss.lupic.retriever.FileRetriever">
			<xxx></xxx>
			<yyy></yyy>
		</image-retriever>
		<perception>
			<!--
				unperceptible treshold of color difference in scope of one pixel
			-->
			<!-- 0-768 -->
			<one-pixel-treshold>5</one-pixel-treshold>
			<!--
				unperceptible treshold of color difference of one pixel to be
				recognized as perceptible difference in global image scope
			-->
			<!-- 0-768 -->
			<global-difference-treshold>10</global-difference-treshold>
			<!-- amount of pixels perceptually different -->
			<!-- % of image surface / 0-* of pixels differ  -->
			<global-difference-pixel-amount>1%</global-difference-pixel-amount>
		</perception>
		<masks type="ignore-bitmap">
			<mask id="xxx" source="xxx.png" />
		</masks>
		<masks type="selective-alpha">
			<mask id="yyy" source="yyy.png" vertical-align="bottom" />
		</masks>
	</global-configuration>
</visual-suite>